{
  "checks": [
    {
      "conclusion": "SUCCESS",
      "name": "Compile-check all features",
      "status": "COMPLETED"
    }
  ],
  "gate_query_completed_at": "2026-07-04T00:00:00Z",
  "gate_query_head_sha": "e36d97517d8d0b27faca1abe5e5c63f9f88684d9",
  "head_sha": "e36d97517d8d0b27faca1abe5e5c63f9f88684d9",
  "human_authorization": {
    "actor": "maintainer",
    "source": "chat",
    "summary": "merge approved"
  },
  "is_draft": false,
  "lane_failures": [
    {
      "failure_kind": "usage_limit",
      "lane_id": "merge-reviewer-1",
      "observed_marker": "You've hit your usage limit"
    }
  ],
  "linked_issue": 716,
  "merge_state": "CLEAN",
  "pr": 718,
  "review_source": "self_review",
  "review_threads": [
    {
      "is_outdated": false,
      "is_resolved": true,
      "resolved_by": "maintainer",
      "resolver_role": "human",
      "url": "https://example.invalid/self-review-unauthorized"
    }
  ],
  "reviews": [],
  "state": "OPEN",
  "review_artifact": null
}
