{
  "checks": [
    {
      "conclusion": "SUCCESS",
      "name": "Compile-check all features",
      "status": "COMPLETED"
    }
  ],
  "head_sha": "e36d97517d8d0b27faca1abe5e5c63f9f88684d9",
  "lane_failures": [],
  "review_source": "independent_lane",
  "gate_query_completed_at": "2026-07-04T00:00:00Z",
  "gate_query_head_sha": "e36d97517d8d0b27faca1abe5e5c63f9f88684d9",
  "human_authorization": {
    "actor": "maintainer",
    "source": "chat",
    "summary": "merge approved"
  },
  "is_draft": false,
  "linked_issue": 716,
  "merge_state": "CLEAN",
  "pr": 718,
  "review_threads": [
    {
      "is_outdated": false,
      "is_resolved": true,
      "resolved_by": "reviewer-1",
      "resolver_role": "reviewer_lane",
      "url": "https://github.com/majiayu000/litellm-rs/pull/718#discussion_r3473213282"
    }
  ],
  "reviews": [
    {
      "author": "gemini-code-assist",
      "state": "COMMENTED"
    }
  ],
  "state": "OPEN",
  "merge_record": {
    "merge_path": "api_fallback",
    "remote_confirmed": true,
    "merge_commit_sha": "bbbb000000000000000000000000000000000002"
  },
  "review_artifact": {
    "pr": 718,
    "reviewed_head_sha": "e36d97517d8d0b27faca1abe5e5c63f9f88684d9",
    "source": "independent_lane",
    "verdict": "APPROVE",
    "gate_decision": "allowed",
    "sha256": "aaaaaaaaaaaaaaaaaaaaaaaaaaaaaaaaaaaaaaaaaaaaaaaaaaaaaaaaaaaaaaaa",
    "diff_sha256": "bbbbbbbbbbbbbbbbbbbbbbbbbbbbbbbbbbbbbbbbbbbbbbbbbbbbbbbbbbbbbbbb",
    "checked_at": "2026-07-04T00:00:00Z"
  }
}
